id,name,description
0,Ashcan School,"The Ashcan School, also called the Ash Can School, was an artistic movement in the United States during the late 19th-early 20th century[1] that produced works portraying scenes of daily life in New York, often in the city's poorer neighborhoods.

The artists working in this style included Robert Henri (1865–1929), George Luks (1867–1933), William Glackens (1870–1938), John Sloan (1871–1951), and Everett Shinn (1876–1953). Some of them met studying together under the renowned realist Thomas Anshutz at the Pennsylvania Academy of the Fine Arts; others met in the newspaper offices of Philadelphia where they worked as illustrators. Theresa Bernstein, who studied at the Philadelphia School of Design for Women, was also a part of the Ashcan School. She was friends with many of its better-known members, including Sloan with whom she co-founded the Society of Independent Artists.

The movement, which took some inspiration from Walt Whitman's epic poem Leaves of Grass, has been seen as emblematic of the spirit of political rebellion of the period."
1,Pre-Raphaelite Brotherhood,"The Pre-Raphaelite Brotherhood (later known as the Pre-Raphaelites) was a group of English painters, poets, and art critics, founded in 1848 by William Holman Hunt, John Everett Millais, Dante Gabriel Rossetti, William Michael Rossetti, James Collinson, Frederic George Stephens and Thomas Woolner who formed a seven-member ""Brotherhood"" modelled in part on the Nazarene movement.[1] The Brotherhood was only ever a loose association and their principles were shared by other artists of the time, including Ford Madox Brown, Arthur Hughes and Marie Spartali Stillman. Later followers of the principles of the Brotherhood included Edward Burne-Jones, William Morris and John William Waterhouse.

The group sought a return to the abundant detail, intense colours and complex compositions of Quattrocento Italian art. They rejected what they regarded as the mechanistic approach first adopted by Mannerist artists who succeeded Raphael and Michelangelo. The Brotherhood believed the Classical poses and elegant compositions of Raphael in particular had been a corrupting influence on the academic teaching of art, hence the name ""Pre-Raphaelite"". In particular, the group objected to the influence of Sir Joshua Reynolds, founder of the English Royal Academy of Arts, whom they called ""Sir Sloshua"". To the Pre-Raphaelites, according to William Michael Rossetti, ""sloshy"" meant ""anything lax or scamped in the process of painting ... and hence ... any thing or person of a commonplace or conventional kind"".[2] The group associated their work with John Ruskin,[3] an English critic whose influences were driven by his religious background. Christian themes were abundant.[4]

The group continued to accept the concepts of history painting and mimesis, imitation of nature, as central to the purpose of art. The Pre-Raphaelites defined themselves as a reform movement, created a distinct name for their form of art, and published a periodical, The Germ, to promote their ideas. The group's debates were recorded in the Pre-Raphaelite Journal. The Brotherhood separated after almost five years."
2,Synthetism,"Synthetism is a term used by post-Impressionist artists like Paul Gauguin, Émile Bernard and Louis Anquetin to distinguish their work from Impressionism. Earlier, Synthetism has been connected to the term Cloisonnism, and later to Symbolism.[1] The term is derived from the French verb synthétiser (to synthesize or to combine so as to form a new, complex product)."
3,Tonalism,"Tonalism was an artistic style that emerged in the 1880s when American artists began to paint landscape forms with an overall tone of colored atmosphere or mist. Between 1880 and 1915, dark, neutral hues such as gray, brown or blue, often dominated compositions by artists associated with the style.[1] During the late 1890s, American art critics began to use the term ""tonal"" to describe these works, as well as the lesser-known synonyms Quietism and Intimism.[2][3] Two of the leading associated painters were George Inness and James McNeill Whistler.[4]

Tonalism is sometimes used to describe American landscapes derived from the French Barbizon style,[5] which emphasized mood and shadow.[6] Tonalism was eventually eclipsed by Impressionism and European modernism.

Australian Tonalism emerged as an art movement in Melbourne during the 1910s."
4,Symbolism,"Symbolism was a late 19th-century art movement of French and Belgian origin in poetry and other arts seeking to represent absolute truths symbolically through language and metaphorical images, mainly as a reaction against naturalism and realism.

In literature, the style originates with the 1857 publication of Charles Baudelaire's Les Fleurs du mal. The works of Edgar Allan Poe, which Baudelaire admired greatly and translated into French, were a significant influence and the source of many stock tropes and images. The aesthetic was developed by Stéphane Mallarmé and Paul Verlaine during the 1860s and 1870s. In the 1880s, the aesthetic was articulated by a series of manifestos and attracted a generation of writers. The term ""symbolist"" was first applied by the critic Jean Moréas, who invented the term to distinguish the Symbolists from the related Decadents of literature and of art."
5,Intimism,"Intimism (French: intimisme) was an artistic movement in the late 19th-century and early 20th-century that involved the depiction of banal yet personal domestic scenes, particularly those within domestic interiors. Intimism was most notably practiced by French painters Édouard Vuillard and Pierre Bonnard after the 1899 disbandment of Les Nabis.[1][2] Edgar Degas and Felix Vallotton have also been characterized as intimists.[3] The main interest of the intimists was their own intimate life such as portraying their family members instead of focusing on more general topics.[4]

French art critic Camille Mauclair defined Intimism as:[5]

a revelation of the soul through the things painted, the magnetic suggestion of what lies behind them through the description of the outer appearance, the intimate meaning of the spectacles of life

While the movement is often associated with Impressionism, the Intimists diverged from the Impressionists in abandoning a focus on formal accuracy in depiction of light, color, and perspective in favor of emphasized texture, exaggerated palette, and merged figure and ground.[6][2][7]

The term ""intimism"" has since been extended to artists outside of the historical period who utilize similar techniques. Intimist film, for example, refers to cinema that utilizes domestic narratives or places focus on the mundane.[8] Brian Fallon referred to Veronica Bolay as an intimiste."
6,Newlyn School,"The Newlyn School was an art colony of artists based in or near Newlyn, a fishing village adjacent to Penzance, on the south coast of Cornwall, from the 1880s until the early twentieth century. The establishment of the Newlyn School was reminiscent of the Barbizon School in France, where artists fled Paris to paint in a more pure setting emphasising natural light. These schools along with a related California movement were also known as En plein air.

Some of the first British artists to settle in the area had already travelled in Brittany, but found in Newlyn a comparable English environment with a number of things guaranteed to attract them: fantastic light, cheap living, and the availability of inexpensive models. The artists were fascinated by the fishermen's working life at sea and the everyday life in the harbour and nearby villages. Some paintings showed the hazards and tragedy of the community's life, such as women anxiously looking out to sea as the boats go out, or a young woman crying on hearing news of a disaster. Walter Langley is generally recognised as the pioneer of the Newlyn art colony and Stanhope Forbes, who settled there in 1884, as the father of it. The later Forbes School of Painting, founded by Forbes and his wife Elizabeth in 1899, promoted the study of figure painting. A present-day Newlyn School of Art was formed in 2011 with Arts Council funding providing art courses taught by many of the best-known artists working in Cornwall today.

In the late nineteenth and early twentieth centuries, Lamorna, a nearby fishing village to the south, became popular with artists of the Newlyn School and is particularly associated with the artist S. J. ""Lamorna"" Birch who lived there from 1908."
7,Regionalism,"American Regionalism is an American realist modern art movement that included paintings, murals, lithographs, and illustrations depicting realistic scenes of rural and small-town America primarily in the Midwest. It arose in the 1930s as a response to the Great Depression, and ended in the 1940s due to the end of World War II and a lack of development within the movement. It reached its height of popularity from 1930 to 1935, as it was widely appreciated for its reassuring images of the American heartland during the Great Depression.[1] Despite major stylistic differences between specific artists, Regionalist art in general was in a relatively conservative and traditionalist style that appealed to popular American sensibilities, while strictly opposing the perceived domination of French art."
8,Modernism,"Modernism is both a philosophical and arts movement that arose from broad transformations in Western society during the late 19th and early 20th centuries. The movement reflected a desire for the creation of new forms of art, philosophy, and social organization which reflected the newly emerging industrial world, including features such as urbanization, architecture, new technologies, and war. Artists attempted to depart from traditional forms of art, which they considered outdated or obsolete. The poet Ezra Pound's 1934 injunction to ""Make it New"" was the touchstone of the movement's approach.

Modernist innovations included abstract art, the stream-of-consciousness novel, montage cinema, atonal and twelve-tone music, divisionist painting and modern architecture. Modernism explicitly rejected the ideology of realism[a][2][3] and made use of the works of the past by the employment of reprise, incorporation, rewriting, recapitulation, revision and parody.[b][c][4] Modernism also rejected the certainty of Enlightenment thinking, and many modernists also rejected religious belief.[5][d] A notable characteristic of modernism is self-consciousness concerning artistic and social traditions, which often led to experimentation with form, along with the use of techniques that drew attention to the processes and materials used in creating works of art.[7]

While some scholars see modernism continuing into the 21st century, others see it evolving into late modernism or high modernism.[8] Postmodernism is a departure from modernism and rejects its basic assumptions."
9,Les Nabis,"Les Nabis (French: les nabis, French pronunciation: ​[le nabi]) were a group of young French artists active in Paris from 1888 until 1900, who played a large part in the transition from impressionism and academic art to abstract art, symbolism and the other early movements of modernism. The members included Pierre Bonnard, Maurice Denis, Paul Ranson, Édouard Vuillard, Ker-Xavier Roussel, Félix Vallotton, Paul Sérusier and Auguste Cazalis.[1] Most were students at the Académie Julian in Paris in the late 1880s. The artists shared a common admiration for Paul Gauguin and Paul Cézanne and a determination to renew the art of painting, but varied greatly in their individual styles. They believed that a work of art was not a depiction of nature, but a synthesis of metaphors and symbols created by the artist.[2] In 1900, the artists held their final exhibition and went their separate ways."
10,Academism,"Academic art, or academicism or academism, is a style of painting and sculpture produced under the influence of European academies of art. Specifically, academic art is the art and artists influenced by the standards of the French Académie des Beaux-Arts, which was practiced under the movements of Neoclassicism and Romanticism, and the art that followed these two movements in the attempt to synthesize both of their styles, and which is best reflected by the paintings of William-Adolphe Bouguereau, Thomas Couture, and Hans Makart. In this context it is often called ""academism,"" ""academicism,"" ""art pompier"" (pejoratively), and ""eclecticism,"" and sometimes linked with ""historicism"" and ""syncretism."" Academic art is closely related to Beaux-Arts architecture, which developed in the same place and holds to a similar classicizing ideal.
"
11,Divisionism,"Divisionism, also called chromoluminarism, was the characteristic style in Neo-Impressionist painting defined by the separation of colors into individual dots or patches which interacted optically.[1][2]

By requiring the viewer to combine the colors optically instead of physically mixing pigments, Divisionists believed they were achieving the maximum luminosity scientifically possible. Georges Seurat founded the style around 1884 as chromoluminarism, drawing from his understanding of the scientific theories of Michel Eugène Chevreul, Ogden Rood and Charles Blanc, among others. Divisionism developed along with another style, Pointillism, which is defined specifically by the use of dots of paint and does not necessarily focus on the separation of colors."
12,Renaissance,"Renaissance art (1350 – 1620 AD[1]) is the painting, sculpture, and decorative arts of the period of European history known as the Renaissance, which emerged as a distinct style in Italy in about AD 1400, in parallel with developments which occurred in philosophy, literature, music, science, and technology. Renaissance art took as its foundation the art of Classical antiquity, perceived as the noblest of ancient traditions, but transformed that tradition by absorbing recent developments in the art of Northern Europe and by applying contemporary scientific knowledge. Along with Renaissance humanist philosophy, it spread throughout Europe, affecting both artists and their patrons with the development of new techniques and new artistic sensibilities. For art historians, Renaissance art marks the transition of Europe from the medieval period to the Early Modern age.


Sandro Botticelli, The Birth of Venus, c. 1485, Uffizi, Florence
The body of art, painting, sculpture, architecture, music and literature identified as ""Renaissance art"" was primarily produced during the 14th, 15th, and 16th centuries in Europe under the combined influences of an increased awareness of nature, a revival of classical learning, and a more individualistic view of man. Scholars no longer believe that the Renaissance marked an abrupt break with medieval values, as is suggested by the French word renaissance, literally meaning ""rebirth"". In many parts of Europe, Early Renaissance art was created in parallel with Late Medieval art."
13,Abstract,"Abstract art uses visual language of shape, form, color and line to create a composition which may exist with a degree of independence from visual references in the world.[1]

Western art had been, from the Renaissance up to the middle of the 19th century, underpinned by the logic of perspective and an attempt to reproduce an illusion of visible reality. By the end of the 19th century many artists felt a need to create a new kind of art which would encompass the fundamental changes taking place in technology, science and philosophy. The sources from which individual artists drew their theoretical arguments were diverse, and reflected the social and intellectual preoccupations in all areas of Western culture at that time.[2]

Abstract art, non-figurative art, non-objective art, and non-representational art are all closely related terms. They have similar, but perhaps not identical, meanings.

Abstraction indicates a departure from reality in depiction of imagery in art. This departure from accurate representation can be slight, partial, or complete. Abstraction exists along a continuum. Even art that aims for verisimilitude of the highest degree can be said to be abstract, at least theoretically, since perfect representation is impossible. Artwork which takes liberties, e.g. altering color or form in ways that are conspicuous, can be said to be partially abstract. Total abstraction bears no trace of any reference to anything recognizable. In geometric abstraction, for instance, one is unlikely to find references to naturalistic entities. Figurative art and total abstraction are almost mutually exclusive. But figurative and representational (or realistic) art often contain partial abstraction.

Both geometric abstraction and lyrical abstraction are often totally abstract. Among the very numerous art movements that embody partial abstraction would be for instance fauvism in which color is conspicuously and deliberately altered vis-a-vis reality, and cubism, which alters the forms of the real-life entities depicted."
14,Art Nouveau,"Art Nouveau (/ˌɑːrt nuːˈvoʊ, ˌɑːr/; French: [aʁ nuvo]) is an international style of art, architecture, and applied art, especially the decorative arts. The style is known by different names in different languages: Jugendstil in German, Stile Liberty in Italian, Modernisme in Catalan, and also known as the Modern Style in English. It was popular between 1890 and 1910 during the Belle Époque period,[1] and was a reaction against the academic art, eclecticism and historicism of 19th century architecture and decoration. It was often inspired by natural forms such as the sinuous curves of plants and flowers.[2] Other characteristics of Art Nouveau were a sense of dynamism and movement, often given by asymmetry or whiplash lines, and the use of modern materials, particularly iron, glass, ceramics and later concrete, to create unusual forms and larger open spaces.[3]

One major objective of Art Nouveau was to break down the traditional distinction between fine arts (especially painting and sculpture) and applied arts. It was most widely used in interior design, graphic arts, furniture, glass art, textiles, ceramics, jewellery and metal work. The style responded to leading 19-century theoreticians, such as French architect Eugène-Emmanuel Viollet-le-Duc (1814–1879) and British art critic John Ruskin (1819–1900). In Britain, it was influenced by William Morris and the Arts and Crafts movement. German architects and designers sought a spiritually uplifting Gesamtkunstwerk (""total work of art"") that would unify the architecture, furnishings, and art in the interior in a common style, to uplift and inspire the residents.[3]

The first Art Nouveau houses and interior decoration appeared in Brussels in the 1890s, in the architecture and interior design of houses designed by Paul Hankar, Henry van de Velde, and especially Victor Horta, whose Hôtel Tassel was completed in 1893.[4][5][6] It moved quickly to Paris, where it was adapted by Hector Guimard, who saw Horta's work in Brussels and applied the style for the entrances of the new Paris Métro. It reached its peak at the 1900 Paris International Exposition, which introduced the Art Nouveau work of artists such as Louis Tiffany. It appeared in graphic arts in the posters of Alphonse Mucha, and the glassware of René Lalique and Émile Gallé.

From Belgium and France, Art Nouveau spread to the rest of Europe,[citation needed] taking on different names and characteristics in each country (see Naming section below). It often appeared not only in capitals, but also in rapidly growing cities that wanted to establish artistic identities (Turin and Palermo in Italy; Glasgow in Scotland; Munich and Darmstadt in Germany), as well as in centres of independence movements (Helsinki in Finland, then part of the Russian Empire; Barcelona in Catalonia, Spain).

By 1914, and with the beginning of the First World War, Art Nouveau was largely exhausted. In the 1920s, it was replaced as the dominant architectural and decorative art style by Art Deco and then Modernism.[7] The Art Nouveau style began to receive more positive attention from critics in the late 1960s, with a major exhibition of the work of Hector Guimard at the Museum of Modern Art in 1970."
15,Romanticism,"Romanticism (also known as the Romantic movement or Romantic era) was an artistic, literary, musical and intellectual movement that originated in Europe towards the end of the 18th century; in most areas it was at its peak in the approximate period from 1800 to 1850. Romanticism was characterized by its emphasis on emotion and individualism, clandestine literature, paganism, idealization of nature, suspicion of science and industrialization, as well as glorification of the past with a strong preference for the medieval rather than the classical.[1] It was partly a reaction to the Industrial Revolution,[2] the social and political norms of the Age of Enlightenment, but also the scientific rationalization of nature.[3] It was embodied most strongly in the visual arts, music and literature; it had a major impact on historiography,[4] education,[5] chess, social sciences and the natural sciences.[6] It had a significant and complex effect on politics, with romantic thinkers influencing conservatism, liberalism, radicalism and nationalism.[7]

The movement emphasized intense emotion as an authentic source of aesthetic experience, placing new emphasis on such emotions as fear, horror, terror and awe — especially that experienced in confronting the new aesthetic categories of the sublime and beauty of nature.[8][9] It elevated folk art and ancient custom to something noble, but also spontaneity as a desirable characteristic (as in the musical impromptu). In contrast to the rationalism and classicism of the Enlightenment, Romanticism revived medievalism[10] and elements of art and narrative perceived as authentically medieval in an attempt to escape population growth, early urban sprawl, and industrialism.

Although the movement was rooted in the German Sturm und Drang movement, which preferred intuition and emotion to the rationalism of the Enlightenment,[11] the events and ideologies of the French Revolution were also proximate factors since many of the early Romantics were cultural revolutionaries and sympathetic to the revolution.[12] Romanticism assigned a high value to the achievements of ""heroic"" individualists and artists, whose examples, it maintained, would raise the quality of society. It also promoted the individual imagination as a critical authority allowed of freedom from classical notions of form in art. There was a strong recourse to historical and natural inevitability, a Zeitgeist, in the representation of its ideas. In the second half of the 19th century, Realism was offered as a polar opposite to Romanticism.[13] The decline of Romanticism during this time was associated with multiple processes, including social and political changes."
16,Hudson River School,"The Hudson River School was a mid-19th century American art movement embodied by a group of landscape painters whose aesthetic vision was influenced by Romanticism. The paintings typically depict the Hudson River Valley and the surrounding area, including the Catskill, Adirondack, and White Mountains.

Works by second generation artists expanded to include other locales in New England, the Maritimes, the American West, and South America."
17,Decadent Movement,"The Decadent movement (Fr. décadence, “decay”) was a late-19th-century artistic and literary movement, centered in Western Europe, that followed an aesthetic ideology of excess and artificiality.

The Decadent movement first flourished in France and then spread throughout Europe and to the United States.[1] The movement was characterized by a belief in the superiority of human fantasy[2][3][4] and aesthetic hedonism[5][6][7][8][9][10][11] over logic and the natural world."
18,Munich School,Munich School (Greek: Σχολή του Μονάχου) is the name given to a group of painters who worked in Munich or were trained at the Royal Academy of Fine Arts of Munich (German: Münchner Akademie der Bildenden Künste) between 1850 and 1918. In the second half of the 19th century the Academy became one of the most important institutions in Europe for training artists and attracted students from across Europe and the United States.
