id,name,description
19,Mannerism,"Mannerism is a style of art that was created in the Late Renaissance period, from about 1520 until about 1600. The Mannerist style of painting or sculpture often shows figures that are ""elongated"" (made longer) and ""distorted"" (made into strange shapes"").[1] The aim of the Mannerist artist was usually to make art that looked ""elegant"".[2]

The Mannerist style began in Italy, where the artists were influenced by the figures that Michelangelo painted on the ceiling and in the ""Last Judgement"" in the Sistine Chapel.[2] During the Renaissance, artists like Leonardo da Vinci and Raphael had tried very hard to learn from nature, and to paint things in a way that was very realistic. These two famous painters both died around 1520. Many artists then decided that they were going to use the art of painting to ""express themselves"". They were not going to follow the rules of anatomy and perspective in the way that Leonardo and Raphael did.[2] Mannerist paintings are often full of figures that seem to be twisting, writhing or fighting. The faces of the figures often show strong emotions such as sadness, fear, hatred or sexual feelings.

Not all the painters who were working during the Mannerist period painted in the Mannerist style. Many artists continued to work in the style of the High Renaissance.[1] Painters in the Mannerist style were Tintoretto, Jacopo Pontormo, Agnolo Bronzino, Parmigianino and Rosso Fiorentino. Giambologna and Benvenuti Cellini were Mannerist sculptors. Giulio Romano was a Mannerist architect.[3]

Mannerism spread from Italy to France, Germany and Spain. One of the most famous Mannerist painters was El Greco who worked in Spain.[2] Some other artists who worked in the Mannerist style are the French sculptor Jean Goujon, the Dutch painter Abraham Bloemaert and the German painter Bartolomeus Spranger. Possibly the strangest paintings from this time were by Giuseppe Arcimboldo who did pictures in which people's faces seem to be made from fruit, flowers, fire and even fish."
20,Rocky Mountain School,"The Rocky Mountain School of Art is a school of art prominently featuring Thomas Moran and Albert Bierstadt. This school of art places emphasis on the western territories in the United States, specifically places of nature. Like the Hudson River School, this school of art shows appreciation for the geography of the United States. These paintings display nationalism by encouraging and showing appreciation for westward expansion and depicting the resources and beautiful sights present in the newly discovered lands of the west."
21,Bristol School,"The Bristol School (or Bristol School of Artists) is a term applied retrospectively to describe the informal association and works of a group of artists working in Bristol, England, in the early 19th century.[1] It was mainly active in the 1820s, although the origins and influences of the school have been traced over the wider period 1810–40.[2] During the period of his participation in the activities of the Bristol School, Francis Danby developed the atmospheric, poetical style of landscape painting which then initiated his period of great success in London in the 1820s."
22,Gothic,"Gothic art was a style of medieval art that developed in Northern France out of Romanesque art in the 12th century AD, led by the concurrent development of Gothic architecture. It spread to all of Western Europe, and much of Northern, Southern and Central Europe, never quite effacing more classical styles in Italy. In the late 14th century, the sophisticated court style of International Gothic developed, which continued to evolve until the late 15th century. In many areas, especially Germany, Late Gothic art continued well into the 16th century, before being subsumed into Renaissance art. Primary media in the Gothic period included sculpture, panel painting, stained glass, fresco and illuminated manuscripts. The easily recognizable shifts in architecture from Romanesque to Gothic, and Gothic to Renaissance styles, are typically used to define the periods in art in all media, although in many ways figurative art developed at a different pace.

The earliest Gothic art was monumental sculpture, on the walls of Cathedrals and abbeys. Christian art was often typological in nature (see Medieval allegory), showing the stories of the New Testament and the Old Testament side by side. Saints' lives were often depicted. Images of the Virgin Mary changed from the Byzantine iconic form to a more human and affectionate mother, cuddling her infant, swaying from her hip, and showing the refined manners of a well-born aristocratic courtly lady.

Secular art came into its own during this period with the rise of cities, foundation of universities, increase in trade, the establishment of a money-based economy and the creation of a bourgeois class who could afford to patronize the arts and commission works, resulting in a proliferation of paintings and illuminated manuscripts. Increased literacy and a growing body of secular vernacular literature encouraged the representation of secular themes in art. With the growth of cities, trade guilds were formed and artists were often required to be members of a painters' guild. As a result, because of better record keeping, more artists are known to us by name in this period than any previous; some artists were even so bold as to sign their names."
23,Neoclassicism,"Neoclassicism (also spelled Neo-classicism) was a Western cultural movement in the decorative and visual arts, literature, theatre, music, and architecture that drew inspiration from the art and culture of classical antiquity. Neoclassicism was born in Rome largely thanks to the writings of Johann Joachim Winckelmann, at the time of the rediscovery of Pompeii and Herculaneum, but its popularity spread all over Europe as a generation of European art students finished their Grand Tour and returned from Italy to their home countries with newly rediscovered Greco-Roman ideals.[1][2] The main Neoclassical movement coincided with the 18th-century Age of Enlightenment, and continued into the early 19th century, laterally competing with Romanticism. In architecture, the style continued throughout the 19th, 20th and up to the 21st century.

European Neoclassicism in the visual arts began c. 1760 in opposition to the then-dominant Rococo style. Rococo architecture emphasizes grace, ornamentation and asymmetry; Neoclassical architecture is based on the principles of simplicity and symmetry, which were seen as virtues of the arts of Rome and Ancient Greece, and were more immediately drawn from 16th-century Renaissance Classicism. Each ""neo""-classicism selects some models among the range of possible classics that are available to it, and ignores others. The Neoclassical writers and talkers, patrons and collectors, artists and sculptors of 1765–1830 paid homage to an idea of the generation of Phidias, but the sculpture examples they actually embraced were more likely to be Roman copies of Hellenistic sculptures. They ignored both Archaic Greek art and the works of Late Antiquity. The ""Rococo"" art of ancient Palmyra came as a revelation, through engravings in Wood's The Ruins of Palmyra. Even Greece was all-but-unvisited, a rough backwater of the Ottoman Empire, dangerous to explore, so Neoclassicists' appreciation of Greek architecture was mediated through drawings and engravings, which subtly smoothed and regularized, ""corrected"" and ""restored"" the monuments of Greece, not always consciously.

The Empire style, a second phase of Neoclassicism in architecture and the decorative arts, had its cultural centre in Paris in the Napoleonic era. Especially in architecture, but also in other fields, Neoclassicism remained a force long after the early 19th century, with periodic waves of revivalism into the 20th and even the 21st centuries, especially in the United States and Russia."
24,Avant-Garde,"In the arts and in literature, the term avant-garde (advance guard and vanguard) identifies a genre of art, an experimental work of art, and the experimental artist who created the work of art, which usually is aesthetically innovative, whilst initially being ideologically unacceptable to the artistic Establishment of the time.[2] The military metaphor of an advance guard identifies the artists and writers whose innovations in style, form, and subject-matter challenge the artistic and aesthetic validity of the established forms of art and the literary traditions of their time; thus how the artists who created the anti-novel and Surrealism were ahead of their times.[3]

As a stratum of the intelligentsia of a society, avant-garde artists promote progressive and radical politics and advocate for societal reform with and through works of art. In the essay ""The Artist, the Scientist, and the Industrialist"" (1825) Benjamin Olinde Rodrigues’s political usage of vanguard identified the moral obligation of artists to ""serve as [the] avant-garde"" of the people, because ""the power of the arts is, indeed, the most immediate and fastest way"" to realise social, political, and economic reforms.[4]

In the realm of culture, the artistic experiments of the avant-garde push the aesthetic boundaries of societal norms, such as the disruptions of modernism in poetry, fiction, and drama, painting, music, and architecture, the occurred in the late 19th and in the early 20th centuries.[5] In art history the socio-cultural functions of avant-garde art trace from Dada (1915–1920s) through the Situationist International (1957–1972) to the Postmodernism of the American Language poets (1960s–1970s)."
25,Baroque,"The Baroque (UK: /bəˈrɒk/, US: /bəˈroʊk/; French: [baʁɔk]) is a style of architecture, music, dance, painting, sculpture, poetry, and other arts that flourished in Europe from the early 17th century until the 1750s.[1] In the territories of the Spanish and Portuguese empires including the Iberian Peninsula it continued, together with new styles, until the first decade of the 19th century. It followed Renaissance art and Mannerism and preceded the Rococo (in the past often referred to as ""late Baroque"") and Neoclassical styles. It was encouraged by the Catholic Church as a means to counter the simplicity and austerity of Protestant architecture, art, and music, though Lutheran Baroque art developed in parts of Europe as well.[2]

The Baroque style used contrast, movement, exuberant detail, deep colour, grandeur, and surprise to achieve a sense of awe. The style began at the start of the 17th century in Rome, then spread rapidly to France, northern Italy, Spain, and Portugal, then to Austria, southern Germany, and Russia. By the 1730s, it had evolved into an even more flamboyant style, called rocaille or Rococo, which appeared in France and Central Europe until the mid to late 18th century.

In the decorative arts, the style employs plentiful and intricate ornamentation. The departure from Renaissance classicism has its own ways in each country. But a general feature is that everywhere the starting point is the ornamental elements introduced by the Renaissance. The classical repertoire is crowded, dense, overlapping, loaded, in order to provoke shock effects. New motifs introduced by Baroque are: the cartouche, trophies and weapons, baskets of fruit or flowers, and others, made in marquetry, stucco, or carved."
26,Venetian School,"Venetian painting was a major force in Italian Renaissance painting and beyond. Beginning with the work of Giovanni Bellini (c. 1430–1516) and his brother Gentile Bellini (c. 1429–1507) and their workshops, the major artists of the Venetian school included Giorgione (c. 1477–1510), Titian (c. 1489–1576), Tintoretto (1518–1594), Paolo Veronese (1528–1588) and Jacopo Bassano (1510–1592) and his sons. Considered to give primacy to colour over line,[1] the tradition of the Venetian school contrasted with the Mannerism prevalent in the rest of Italy. The Venetian style exerted great influence upon the subsequent development of Western painting.[2]


Canaletto, The Entrance to the Grand Canal, c. 1730, a typical veduta.
By chance, the main phases of Venetian painting fit rather neatly into the centuries. The glories of the 16th century were followed by a great fall-off in the 17th, but an unexpected revival in the 18th,[3] when Venetian painters enjoyed great success around Europe, as Baroque painting turned to Rococo. This had ended completely by the extinction of the Republic of Venice in 1797 and since then, though much painted by others, Venice has not had a continuing style or tradition of its own.[4]

Though a long decline in the political and economic power of the Republic began before 1500, Venice at that date remained ""the richest, most powerful, and most populous Italian city""[5] and controlled significant territories on the mainland, known as the terraferma, which included several small cities who contributed artists to the Venetian school, in particular Padua, Brescia and Verona. The Republic's territories also included Istria, Dalmatia and the islands now off the Croatian coast, who also contributed. Indeed, ""the major Venetian painters of the sixteenth century were rarely natives of the city"" itself,[6] and some mostly worked in the Republic's other territories, or further afield.[7]


Giovanni Bellini, San Zaccaria Altarpiece, 1505, a late work, San Zaccaria, Venice
The rest of Italy tended to ignore or underestimate Venetian painting; Giorgio Vasari's neglect of the school in the first edition of his Lives of the Most Excellent Painters, Sculptors, and Architects in 1550 was so conspicuous that he realized he needed to visit Venice for extra material in his second edition of 1568.[8] In contrast, foreigners, for whom Venice was often the first major Italian city visited, always had a great appreciation for it and, after Venice itself, the best collections are now in the large European museums rather than other Italian cities. At the top, princely, level, Venetian artists tended to be the most sought-after for commissions abroad, from Titian onwards, and in the 18th century most of the best painters spent significant periods abroad, generally with great success."
27,Realism,"Realism in the arts is generally the attempt to represent subject matter truthfully, without artificiality and avoiding speculative and supernatural elements. The term is often used interchangeably with naturalism, although these terms are not synonymous. Naturalism, as an idea relating to visual representation in Western art, seeks to depict objects with the least possible amount of distortion and is tied to the development of linear perspective and illusionism in Renaissance Europe.[1] Realism, while predicated upon naturalistic representation and a departure from the idealization of earlier academic art, often refers to a specific art historical movement that originated in France in the aftermath of the French Revolution of 1848. With artists like Gustave Courbet capitalizing on the mundane, ugly or sordid, realism was motivated by the renewed interest in the common man and the rise of leftist politics.[2] The Realist painters rejected Romanticism, which had come to dominate French literature and art, with roots in the late 18th century.

In 19th-century Europe, ""Naturalism"" or the ""Naturalist school"" was somewhat artificially erected as a term representing a breakaway sub-movement of realism, that attempted (not wholly successfully) to distinguish itself from its parent by its avoidance of politics and social issues, and liked to proclaim a quasi-scientific basis, playing on the sense of ""naturalist"" as a student of natural history, as the biological sciences were then generally known.

There have been various movements invoking realism in the other arts, such as the opera style of verismo, literary realism, theatrical realism, and Italian neorealist cinema."
28,Delft School,"The Delft School is a category of mid-17th-century Dutch Golden Age painting named after its main base, Delft. It is best known for genre painting: images of domestic life, views of households, church interiors, courtyards, squares and the streets of that city. Carel Fabritius and Nicolaes Maes are seen as the originators of these localised specialties in the 1640s that were continued in the 1650s by Pieter de Hooch and Johannes Vermeer. Vermeer is the most famous of these painters today. The architectural interiors of Gerard Houckgeest, Emanuel de Witte and Hendrick Cornelisz. van Vliet are also notable contributions. Besides the genres most closely associated with Delft painters, artists in the city continued to produce still life and history paintings, portraits for patrons and the court, and decorative pieces of art that reflect more general tendencies in Dutch art of the period."
29,Norwich School,"The Norwich School of painters was the first provincial art movement established in Britain, active in the early 19th century. Artists of the school were inspired by the natural environment of the Norfolk landscape and owed some influence to the work of landscape painters of the Dutch Golden Age such as Hobbema and Ruisdael."
30,Luminism,"Luminism is an American landscape painting style of the 1850s to 1870s, characterized by effects of light in landscape, through the use of aerial perspective and the concealment of visible brushstrokes. Luminist landscapes emphasize tranquility, and often depict calm, reflective water and a soft, hazy sky. Artists who were most central to the development of the luminist style include Fitz Hugh Lane, Martin Johnson Heade, Sanford Gifford, and John F. Kensett.[1] Painters with a less clear affiliation include Frederic Edwin Church, Jasper Cropsey, Albert Bierstadt, Worthington Whittredge, Raymond Dabb Yelland, Alfred Thompson Bricher, James Augustus Suydam, and David Johnson.[2] Some precursor artists are George Harvey and Robert Salmon."
31,Expressionism,"Expressionism is a modernist movement, initially in poetry and painting, originating in Northern Europe around the beginning of the 20th century. Its typical trait is to present the world solely from a subjective perspective, distorting it radically for emotional effect in order to evoke moods or ideas.[1][2] Expressionist artists have sought to express the meaning[3] of emotional experience rather than physical reality.[3][4]

Expressionism developed as an avant-garde style before the First World War. It remained popular during the Weimar Republic,[1] particularly in Berlin. The style extended to a wide range of the arts, including expressionist architecture, painting, literature, theatre, dance, film and music.[5]

The term is sometimes suggestive of angst. In a historical sense, much older painters such as Matthias Grünewald and El Greco are sometimes termed expressionist, though the term is applied mainly to 20th-century works. The Expressionist emphasis on individual and subjective perspective has been characterized as a reaction to positivism and other artistic styles such as Naturalism and Impressionism.["
32,Dutch Golden Age,"Dutch Golden Age painting is the painting of the Dutch Golden Age, a period in Dutch history roughly spanning the 17th century,[1] during and after the later part of the Eighty Years' War (1568–1648) for Dutch independence.

The new Dutch Republic was the most prosperous nation in Europe and led European trade, science, and art. The northern Netherlandish provinces that made up the new state had traditionally been less important artistic centres than cities in Flanders in the south. The upheavals and large-scale transfers of population of the war, and the sharp break with the old monarchist and Catholic cultural traditions, meant that Dutch art had to reinvent itself almost entirely, a task in which it was very largely successful. The painting of religious subjects declined very sharply, but a large new market for all kinds of secular subjects grew up.

Although Dutch painting of the Golden Age is included in the general European period of Baroque painting, and often shows many of its characteristics, most lacks the idealization and love of splendour typical of much Baroque work, including that of neighbouring Flanders. Most work, including that for which the period is best known, reflects the traditions of detailed realism inherited from Early Netherlandish painting. A distinctive feature of the period is the proliferation of distinct genres of paintings,[2] with the majority of artists producing the bulk of their work within one of these. The full development of this specialization is seen from the late 1620s, and the period from then until the French invasion of 1672 is the core of Golden Age painting. Artists would spend most of their careers painting only portraits, genre scenes, landscapes, seascapes and ships, or still lifes, and often a particular sub-type within these categories. Many of these types of subject were new in Western painting, and the way the Dutch painted them in this period was decisive for their future development."
33,Heidelberg School,"The Heidelberg School was an Australian art movement of the late 19th century. It has been described as Australian impressionism.[1]

Melbourne art critic Sidney Dickinson coined the term in an 1891 review of works by Arthur Streeton and Walter Withers, two local artists who painted en plein air in Heidelberg on the city's rural outskirts. The term has since evolved to cover painters who worked together at ""artists' camps"" around Melbourne and Sydney in the 1880s and 1890s. Along with Streeton and Withers, Tom Roberts, Charles Conder and Frederick McCubbin are considered key figures of the movement. Drawing on naturalist and impressionist ideas, they sought to capture Australian life, the bush, and the harsh sunlight that typifies the country.

The movement emerged at a time of strong nationalist sentiment in Australia, then a group of colonies on the cusp of federating. The artists' paintings, not unlike the bush poems of the Bulletin School, were celebrated for being distinctly Australian in character, and by the early 20th century, critics had come to identify the movement as the beginning of an Australian tradition in Western art. Many of their most recognisable works can be seen in Australia's major public galleries, including the National Gallery of Australia, the National Gallery of Victoria and the Art Gallery of New South Wales."
34,Pointillism,"Pointillism (/ˈpwæ̃tɪlɪzəm/, also US: /ˈpwɑːn-ˌ ˈpɔɪn-/)[1] is a technique of painting in which small, distinct dots of color are applied in patterns to form an image.

Georges Seurat and Paul Signac developed the technique in 1886, branching from Impressionism. The term ""Pointillism"" was coined by art critics in the late 1880s to ridicule the works of these artists, but is now used without its earlier pejorative connotation.[2] The movement Seurat began with this technique is known as Neo-impressionism. The Divisionists used a similar technique of patterns to form images, though with larger cube-like brushstrokes."
35,Utagawa School,"The Utagawa school (歌川派) was one of the main schools of ukiyo-e, founded by Utagawa Toyoharu. It was the largest ukiyo-e school of its period. The main styles were bijin-ga (beautiful women) and uki-e (perspective picture). His pupil, Toyokuni I, took over after Toyoharu's death and led the group to become the most famous and powerful woodblock print school for the remainder of the 19th century.

Hiroshige,[1] Kunisada, Kuniyoshi and Yoshitoshi were Utagawa students. The school became so successful and well known that today more than half of all surviving ukiyo-e prints are from it.

Founder Toyoharu adopted Western-style deep perspective, an innovation in Japanese art. His immediate followers, Utagawa Toyohiro and Toyokuni adopted bolder, more sensuous styles than Toyoharu and specialized in different genres — Toyohiro in landscapes and Toyokuni in kabuki actor prints. Later artists in the school specialized in other genres, such as warrior prints and mythic parodies."
36,Purismo,"Purismo was an Italian cultural movement which began in the 1820s. The group intended to restore and preserve language through the study of medieval authors, and such study extended to the visual arts.

Inspired by the Nazarenes from Germany, the artists of Purismo reject Neoclassicism and emulated the works of Raphael, Giotto and Fra Angelico. The movement flourished through 1860, and reflected the taste for revivalist styles, which in Italy was fed growing interest in Italian national identity and artistic heritage."
37,Vienna Secession,"The Vienna Secession (German: Wiener Secession; also known as the Union of Austrian Artists, or Vereinigung Bildender Künstler Österreichs) is an art movement, closely related to Art Nouveau, that was formed in 1897 by a group of Austrian painters, graphic artists, sculptors and architects, including Josef Hoffman, Koloman Moser, Otto Wagner and Gustav Klimt. They resigned from the Association of Austrian Artists in protest against its support for more traditional artistic styles. Their most influential architectural work was the Secession Building designed by Joseph Maria Olbrich as a venue for expositions of the group. Their official magazine was called Ver Sacrum (Sacred Spring, in Latin), which published highly stylised and influential works of graphic art. In 1905 the group itself split, when some of the most prominent members, including Klimt, Wagner, and Hoffmann, resigned in a dispute over priorities, but it continued to function, and still functions today,[when?] from its headquarters in the Secession Building. In its current[when?] form, the Secession exhibition gallery is independently led and managed by artists."
